{
  "protocol_version": "0.2.8",
  "project_id": "mcp-drive-job-001",
  "project_name": "Synthetic Bracket Fabrication Review",
  "project_type": "fabrication_request",
  "project_description": "Synthetic local fabrication review request for Offset Mounting Bracket generated by the MCP drive proof harness.",
  "design_files": [
    {
      "file_name": "offset_mounting_bracket.step",
      "file_type": "step",
      "path": "synthetic_cad/offset_mounting_bracket.step",
      "notes": "Synthetic local CAD metadata only; no proprietary CAD included."
    }
  ],
  "geometry_summary": "Bent steel bracket with two slotted mounting holes and one gusseted flange.",
  "bom_items": [
    {
      "item_id": "BKT-001",
      "name": "Offset Mounting Bracket",
      "category": "fabricated_part",
      "quantity": 12,
      "unit": "ea",
      "material": "A36",
      "dimensions": {
        "length_mm": 220,
        "width_mm": 90,
        "thickness_mm": 8
      },
      "finish": "zinc-rich primer",
      "supplier_preference": "local_sandbox_only",
      "substitution_allowed": false,
      "notes": "Requested operations: laser_cut, press_brake, deburr"
    }
  ],
  "material_specs": [
    "steel A36 plate"
  ],
  "finish_requirements": [
    "zinc-rich primer"
  ],
  "dimensions": {
    "length_mm": 220,
    "width_mm": 90,
    "thickness_mm": 8
  },
  "site_conditions": [
    "Synthetic local submission only.",
    "No physical site visit or external delivery path is authorized."
  ],
  "location_context": {
    "submission_mode": "local_sandbox",
    "physical_site_required": false,
    "delivery_region": "N/A"
  },
  "quote_categories": [
    "fabrication_review",
    "fabrication_review"
  ],
  "capability_requirements": [
    {
      "capability_id": "laser_cutting",
      "capability_type": "fabrication_process",
      "required_for": "Blank preparation",
      "description": "Cut bracket blank from steel plate using local review assumptions only.",
      "licensed_trade": false,
      "certification_required": false,
      "local_required": true,
      "risk_level": "medium",
      "notes": "Review only; no fabrication approval is granted."
    },
    {
      "capability_id": "press_brake_forming",
      "capability_type": "fabrication_process",
      "required_for": "Bracket bend operation",
      "description": "Form flange bend to the requested angle within review tolerance.",
      "licensed_trade": false,
      "certification_required": false,
      "local_required": true,
      "risk_level": "medium",
      "notes": "Human review remains required before any external fabrication step."
    }
  ],
  "install_scope": "Fabrication review only. No install authorization is included.",
  "licensed_trade_required": false,
  "code_review_required": false,
  "permit_review_required": false,
  "safety_notes": [
    "Local-only synthetic fixture; no physical release is authorized.",
    "Verify bend orientation before fabrication review.",
    "Confirm hole spacing against drawing metadata."
  ],
  "unknowns": [
    "Confirm final mounting hardware size before fabrication release.",
    "Confirm primer compatibility with final install environment."
  ],
  "assumptions": [
    "This request stays inside the sandbox-only review boundary.",
    "Human approval is required before any external release or fabrication action."
  ],
  "tolerances": [
    "+/-0.25 mm on hole centers; bend angle tolerance +/-1 degree"
  ],
  "human_approval_required": true
}